{
  "schema": "floor@1",
  "id": "mrt-r-platform-b4",
  "slab": {
    "outline": [
      [83.2, -84],
      [90.3, -85.5],
      [88.1, -100.6],
      [99.3, -101.7],
      [101.6, -88],
      [109.6, -89.7],
      [152.9, 50.8],
      [127.7, 58.2]
    ],
    "source": "trtc-info-b4",
    "confidence": 3,
    "status": "traced"
  },
  "areas": [
    {
      "id": "a-rp-platform",
      "kind": "platform",
      "system": "trtc",
      "polygon": [
        [105.3, -86.8],
        [147.4, 49.4],
        [130.9, 54.2],
        [88.7, -83.2]
      ],
      "source": "trtc-info-b4",
      "confidence": 3,
      "status": "traced",
      "note": "島式月台，長 141m 為比例基準（高運量 6 節）；寬度依 trtc-info-b4 重描"
    },
    {
      "id": "a-rp-track-e",
      "kind": "track",
      "system": "trtc",
      "polygon": [
        [109.6, -89.7],
        [152.9, 50.8],
        [148.2, 52.1],
        [104.8, -88.7]
      ],
      "source": "trtc-info-b4",
      "confidence": 3,
      "status": "traced",
      "note": "一月台側軌道（往淡水·北投）"
    },
    {
      "id": "a-rp-track-w",
      "kind": "track",
      "system": "trtc",
      "polygon": [
        [88.1, -85],
        [131.7, 57],
        [127.7, 58.2],
        [83.2, -84]
      ],
      "source": "trtc-info-b4",
      "confidence": 3,
      "status": "traced",
      "note": "二月台側軌道（往象山）"
    }
  ],
  "units": [
    {
      "id": "u-rp-stairs-s",
      "kind": "stair-void",
      "height": 0.3,
      "polygon": [
        [100.3, -64.3],
        [108.6, -65.2],
        [109.8, -55.2],
        [101.5, -54.3]
      ],
      "source": "trtc-info-b4",
      "confidence": 3,
      "status": "traced",
      "note": "梯群開口（依圖示範圍）"
    },
    {
      "id": "u-rp-stairs-c",
      "kind": "stair-void",
      "height": 0.3,
      "polygon": [
        [109.6, -34.5],
        [117.9, -35.4],
        [119.1, -25.4],
        [110.8, -24.5]
      ],
      "source": "trtc-info-b4",
      "confidence": 3,
      "status": "traced",
      "note": "梯群開口（依圖示範圍）"
    },
    {
      "id": "u-rp-stairs-n",
      "kind": "stair-void",
      "height": 0.3,
      "polygon": [
        [125.1, 17.1],
        [133.4, 16.2],
        [134.5, 26.2],
        [126.3, 27.1]
      ],
      "source": "trtc-info-b4",
      "confidence": 3,
      "status": "traced",
      "note": "梯群開口（依圖示範圍）"
    },
    {
      "id": "u-rp-stairs-s2",
      "kind": "stair-void",
      "height": 0.3,
      "polygon": [
        [89.2, -99.3],
        [96.5, -100.1],
        [97.9, -87.9],
        [90.6, -87.1]
      ],
      "source": "trtc-info-b4",
      "confidence": 3,
      "status": "traced",
      "note": "梯群開口（依圖示範圍）"
    }
  ],
  "pois": [
    {
      "id": "p-rp-sign-1",
      "kind": "sign",
      "system": "trtc",
      "position": [121, -7.5],
      "name": {
        "zh": "中段電梯指標"
      },
      "source": "trtc-info-b4",
      "confidence": 2,
      "note": "示範集：錨定 n-rp-006 中段電梯口"
    },
    {
      "id": "p-rp-sign-2",
      "kind": "sign",
      "system": "trtc",
      "position": [128.5, 21.8],
      "name": {
        "zh": "北梯群指標"
      },
      "source": "trtc-info-b4",
      "confidence": 2,
      "note": "示範集：錨定 n-rp-004 北梯群口"
    },
    {
      "id": "p-rp-sign-3",
      "kind": "sign",
      "system": "trtc",
      "position": [93.5, -80.5],
      "name": {
        "zh": "南端電梯指標"
      },
      "source": "trtc-info-b4",
      "confidence": 2,
      "note": "示範集：錨定 n-rp-002 南端電梯口"
    }
  ],
  "nav": {
    "nodes": [
      {
        "id": "n-rp-001",
        "xy": [104.9, -60.6],
        "area": "a-rp-platform",
        "name": {
          "zh": "淡水信義線月台（南端）"
        }
      },
      {
        "id": "n-rp-002",
        "xy": [92.9, -81.4],
        "tier": 2,
        "area": "a-rp-platform",
        "name": {
          "zh": "淡水信義線月台 南端電梯口"
        }
      },
      {
        "id": "n-rp-003",
        "xy": [118, -15],
        "tier": 0,
        "area": "a-rp-platform",
        "name": {
          "zh": "淡水信義線月台（中段）"
        }
      },
      {
        "id": "n-rp-004",
        "xy": [129.5, 20.8],
        "area": "a-rp-platform",
        "name": {
          "zh": "淡水信義線月台 北梯群口"
        }
      },
      {
        "id": "n-rp-005",
        "xy": [137.2, 42.9],
        "tier": 0,
        "area": "a-rp-platform",
        "name": {
          "zh": "淡水信義線月台（北端）"
        }
      },
      {
        "id": "n-rp-006",
        "xy": [122.2, -6.8],
        "tier": 2,
        "area": "a-rp-platform",
        "name": {
          "zh": "淡水信義線月台 中段電梯口"
        }
      }
    ],
    "edges": [
      {
        "from": "n-rp-002",
        "to": "n-rp-001",
        "kind": "walk"
      },
      {
        "from": "n-rp-001",
        "to": "n-rp-003",
        "kind": "walk"
      },
      {
        "from": "n-rp-003",
        "to": "n-rp-004",
        "kind": "walk"
      },
      {
        "from": "n-rp-004",
        "to": "n-rp-005",
        "kind": "walk"
      },
      {
        "from": "n-rp-003",
        "to": "n-rp-006",
        "kind": "walk"
      }
    ]
  }
}
