{
  "schema": "floor@1",
  "id": "tra-platform-b2",
  "slab": {
    "outline": [
      [-175, -75],
      [175, -75],
      [175, 75],
      [-175, 75]
    ],
    "source": "tra-b2-map",
    "confidence": 2,
    "note": "站體矩形，東西向延展至 ±175 以容納 330m 月台（wiki 文獻值）；y 向沿用 B1 站體框架；R 線站體豎井在站體之外，不開洞"
  },
  "areas": [
    {
      "id": "a-tp-plat-1",
      "kind": "platform",
      "system": "tra",
      "name": {
        "zh": "高鐵第1月台",
        "en": "HSR Platform 1"
      },
      "sides": {
        "south": "1A",
        "north": "1B"
      },
      "polygon": [
        [-165, -50.5],
        [165, -50.5],
        [165, -41.5],
        [-165, -41.5]
      ],
      "source": "tra-b2-map",
      "confidence": 2,
      "status": "estimated",
      "note": "高鐵第1月台（南端；system 概括為 tra）。台灣高鐵南下往左營／北上往南港。長寬 330×9m 依 wiki 文獻值，橫向中心線依 tra-b2-map 描圖"
    },
    {
      "id": "a-tp-plat-2",
      "kind": "platform",
      "system": "tra",
      "name": {
        "zh": "高鐵第2月台",
        "en": "HSR Platform 2"
      },
      "sides": {
        "south": "2A",
        "north": "2B"
      },
      "polygon": [
        [-165, -27.8],
        [165, -27.8],
        [165, -18.8],
        [-165, -18.8]
      ],
      "source": "tra-b2-map",
      "confidence": 2,
      "status": "estimated",
      "note": "高鐵第2月台（system 概括為 tra）。台灣高鐵南下往左營／北上往南港。長寬 330×9m 依 wiki 文獻值，橫向中心線依 tra-b2-map 描圖"
    },
    {
      "id": "a-tp-plat-3",
      "kind": "platform",
      "system": "tra",
      "name": {
        "zh": "臺鐵第3月台",
        "en": "TRA Platform 3"
      },
      "sides": {
        "south": "3A",
        "north": "3B"
      },
      "polygon": [
        [-165, 0],
        [165, 0],
        [165, 9],
        [-165, 9]
      ],
      "source": "tra-b2-map",
      "confidence": 2,
      "status": "estimated",
      "note": "臺鐵第3月台。西部幹線南下（往鶯歌、桃園方向）、東部幹線往樹林方向。第五股道（通過線）在本月台與 2B 之間。長寬 330×9m 依 wiki 文獻值，橫向中心線依 tra-b2-map 描圖"
    },
    {
      "id": "a-tp-plat-4",
      "kind": "platform",
      "system": "tra",
      "name": {
        "zh": "臺鐵第4月台",
        "en": "TRA Platform 4"
      },
      "sides": {
        "south": "4A",
        "north": "4B"
      },
      "polygon": [
        [-165, 21.5],
        [165, 21.5],
        [165, 30.5],
        [-165, 30.5]
      ],
      "source": "tra-b2-map",
      "confidence": 2,
      "status": "estimated",
      "note": "臺鐵第4月台（北端；往捷運梯群在東段）。往松山、南港、基隆方向；東部幹線往瑞芳、花蓮、臺東方向。長寬 330×9m 依 wiki 文獻值，橫向中心線依 tra-b2-map 描圖"
    },
    {
      "id": "a-tp-track-1a",
      "kind": "track",
      "system": "tra",
      "polygon": [
        [-175, -55],
        [175, -55],
        [175, -50.5],
        [-175, -50.5]
      ],
      "source": "tra-b2-map",
      "confidence": 2,
      "status": "estimated",
      "note": "高鐵 1A 側軌道（第1月台南面）。軌位依月台側別與 wiki 股道數推定；寬 4.5m 貼齊月台邊，長度貼滿 slab（±175）"
    },
    {
      "id": "a-tp-track-1b",
      "kind": "track",
      "system": "tra",
      "polygon": [
        [-175, -41.5],
        [175, -41.5],
        [175, -37],
        [-175, -37]
      ],
      "source": "tra-b2-map",
      "confidence": 2,
      "status": "estimated",
      "note": "高鐵 1B 側軌道（第1月台北面）。軌位依月台側別與 wiki 股道數推定；寬 4.5m 貼齊月台邊，長度貼滿 slab（±175）"
    },
    {
      "id": "a-tp-track-2a",
      "kind": "track",
      "system": "tra",
      "polygon": [
        [-175, -32.3],
        [175, -32.3],
        [175, -27.8],
        [-175, -27.8]
      ],
      "source": "tra-b2-map",
      "confidence": 2,
      "status": "estimated",
      "note": "高鐵 2A 側軌道（第2月台南面）。軌位依月台側別與 wiki 股道數推定；寬 4.5m 貼齊月台邊，長度貼滿 slab（±175）"
    },
    {
      "id": "a-tp-track-2b",
      "kind": "track",
      "system": "tra",
      "polygon": [
        [-175, -18.8],
        [175, -18.8],
        [175, -14.3],
        [-175, -14.3]
      ],
      "source": "tra-b2-map",
      "confidence": 2,
      "status": "estimated",
      "note": "高鐵 2B 側軌道（第2月台北面）。軌位依月台側別與 wiki 股道數推定；寬 4.5m 貼齊月台邊，長度貼滿 slab（±175）"
    },
    {
      "id": "a-tp-track-pass",
      "kind": "track",
      "system": "tra",
      "polygon": [
        [-175, -11.65],
        [175, -11.65],
        [175, -7.15],
        [-175, -7.15]
      ],
      "source": "tra-b2-map",
      "confidence": 2,
      "status": "estimated",
      "note": "臺鐵第五股道（通過線，兩側皆無月台）。軌位依月台側別與 wiki 股道數推定；寬 4.5m，長度貼滿 slab（±175）"
    },
    {
      "id": "a-tp-track-3a",
      "kind": "track",
      "system": "tra",
      "polygon": [
        [-175, -4.5],
        [175, -4.5],
        [175, 0],
        [-175, 0]
      ],
      "source": "tra-b2-map",
      "confidence": 2,
      "status": "estimated",
      "note": "臺鐵 3A 側軌道（第3月台南面）。軌位依月台側別與 wiki 股道數推定；寬 4.5m 貼齊月台邊，長度貼滿 slab（±175）"
    },
    {
      "id": "a-tp-track-3b",
      "kind": "track",
      "system": "tra",
      "polygon": [
        [-175, 9],
        [175, 9],
        [175, 13.5],
        [-175, 13.5]
      ],
      "source": "tra-b2-map",
      "confidence": 2,
      "status": "estimated",
      "note": "臺鐵 3B 側軌道（第3月台北面）。軌位依月台側別與 wiki 股道數推定；寬 4.5m 貼齊月台邊，長度貼滿 slab（±175）"
    },
    {
      "id": "a-tp-track-4a",
      "kind": "track",
      "system": "tra",
      "polygon": [
        [-175, 17],
        [175, 17],
        [175, 21.5],
        [-175, 21.5]
      ],
      "source": "tra-b2-map",
      "confidence": 2,
      "status": "estimated",
      "note": "臺鐵 4A 側軌道（第4月台南面）。軌位依月台側別與 wiki 股道數推定；寬 4.5m 貼齊月台邊，長度貼滿 slab（±175）"
    },
    {
      "id": "a-tp-track-4b",
      "kind": "track",
      "system": "tra",
      "polygon": [
        [-175, 30.5],
        [175, 30.5],
        [175, 35],
        [-175, 35]
      ],
      "source": "tra-b2-map",
      "confidence": 2,
      "status": "estimated",
      "note": "臺鐵 4B 側軌道（第4月台北面）。軌位依月台側別與 wiki 股道數推定；寬 4.5m 貼齊月台邊，長度貼滿 slab（±175）"
    }
  ],
  "pois": [
    {
      "id": "p-tp-sign-1",
      "kind": "sign",
      "system": "tra",
      "position": [77.8, 27.5],
      "name": {
        "zh": "第4月台候車資訊"
      },
      "source": "tra-b2-map",
      "confidence": 2,
      "note": "示範集：錨定 n-tp-002 候車區"
    },
    {
      "id": "p-tp-sign-2",
      "kind": "sign",
      "system": "tra",
      "position": [76.7, 6],
      "name": {
        "zh": "第3月台候車資訊"
      },
      "source": "tra-b2-map",
      "confidence": 2,
      "note": "示範集：錨定 n-tp-004 候車區"
    },
    {
      "id": "p-tp-sign-3",
      "kind": "sign",
      "system": "tra",
      "position": [92.3, 29.5],
      "name": {
        "zh": "轉乘梯口指標"
      },
      "source": "tra-b2-map",
      "confidence": 2,
      "note": "示範集：錨定 n-tp-001 轉乘梯口"
    }
  ],
  "nav": {
    "nodes": [
      {
        "id": "n-tp-001",
        "xy": [92.8, 30],
        "area": "a-tp-plat-4",
        "name": {
          "zh": "臺鐵第4月台（轉乘梯口）"
        }
      },
      {
        "id": "n-tp-002",
        "xy": [77.8, 26],
        "tier": 0,
        "area": "a-tp-plat-4",
        "name": {
          "zh": "臺鐵第4月台（候車）"
        }
      },
      {
        "id": "n-tp-003",
        "xy": [91.7, 8.5],
        "area": "a-tp-plat-3",
        "name": {
          "zh": "臺鐵第3月台（轉乘梯口）"
        }
      },
      {
        "id": "n-tp-004",
        "xy": [76.7, 4.5],
        "tier": 0,
        "area": "a-tp-plat-3",
        "name": {
          "zh": "臺鐵第3月台（候車）"
        }
      }
    ],
    "edges": [
      {
        "from": "n-tp-001",
        "to": "n-tp-002",
        "kind": "walk"
      },
      {
        "from": "n-tp-003",
        "to": "n-tp-004",
        "kind": "walk"
      }
    ]
  }
}
