{
  "schema": "floor@1",
  "id": "tra-concourse-b1",
  "slab": {
    "outline": [
      [-105, -75],
      [86, -75],
      [86, -84],
      [100, -84],
      [100, -75],
      [105, -75],
      [105, -10],
      [151, 2],
      [140, 55],
      [105, 46],
      [105, 75],
      [-105, 75]
    ],
    "source": "tra-b1-map",
    "confidence": 2,
    "note": "站體矩形＋東翼（往 R 線 B3 通廊）；等角底圖僅供比例參考"
  },
  "areas": [
    {
      "id": "a-tc-corridor",
      "kind": "corridor",
      "system": "shared",
      "polygon": [
        [105, -8],
        [149, 3],
        [139, 53],
        [105, 44]
      ],
      "source": "tra-b1-map",
      "confidence": 2,
      "note": "東翼通廊：B3 長梯與電梯降落區（往捷運淡水線/中山地下街出入口）"
    },
    {
      "id": "a-tc-unpaid-e",
      "kind": "unpaid",
      "system": "tra",
      "polygon": [
        [82, -60],
        [105, -60],
        [105, 60],
        [82, 60]
      ],
      "source": "tra-b1-map",
      "confidence": 2,
      "status": "traced",
      "note": "站體東側非付費帶（東剪票口外）"
    },
    {
      "id": "a-tc-tra-paid",
      "kind": "paid",
      "system": "tra",
      "polygon": [
        [12, -55],
        [82, -55],
        [82, 55],
        [12, 55]
      ],
      "source": "tra-b1-map",
      "confidence": 2,
      "status": "traced",
      "note": "臺鐵東付費島（等角圖示雙付費島＋中央南北非付費通廊；西島與中央通廊未建——西半範圍外）"
    },
    {
      "id": "a-tc-mrt-link",
      "kind": "corridor",
      "system": "shared",
      "polygon": [
        [86, -75],
        [86, -84],
        [100, -84],
        [100, -75]
      ],
      "source": "trtc-info-b1",
      "confidence": 2,
      "status": "traced",
      "note": "北捷穿堂域，暫掛臺鐵檔；北捷 B1 全幅入模時遷移（ADR 0002 站體歸屬妥協）"
    }
  ],
  "units": [
    {
      "id": "u-tc-ticket-office",
      "kind": "room",
      "polygon": [
        [20, 42],
        [45, 42],
        [45, 52],
        [20, 52]
      ],
      "height": 3.5,
      "source": "tra-b1-map",
      "confidence": 2,
      "note": "售票／服務設施示意量體（東島北緣）"
    },
    {
      "id": "u-tc-col-1",
      "kind": "column",
      "polygon": [
        [20, -1],
        [22, -1],
        [22, 1],
        [20, 1]
      ],
      "height": 5,
      "source": "tra-b1-map",
      "confidence": 2,
      "note": "柱位底圖無標示，結構跨距示意（28m 網格）"
    },
    {
      "id": "u-tc-col-2",
      "kind": "column",
      "polygon": [
        [48, -1],
        [50, -1],
        [50, 1],
        [48, 1]
      ],
      "height": 5,
      "source": "tra-b1-map",
      "confidence": 2
    },
    {
      "id": "u-tc-col-3",
      "kind": "column",
      "polygon": [
        [76, -1],
        [78, -1],
        [78, 1],
        [76, 1]
      ],
      "height": 5,
      "source": "tra-b1-map",
      "confidence": 2
    }
  ],
  "gates": [
    {
      "id": "g-tc-tra-in-e",
      "kind": "faregate",
      "system": "tra",
      "direction": "in",
      "accessible": false,
      "line": [
        [82, 2],
        [82, 12]
      ],
      "connects": [
        "a-tc-tra-paid",
        "a-tc-unpaid-e"
      ],
      "source": "tra-b1-map",
      "confidence": 2,
      "status": "traced",
      "note": "東剪票口（東付費島東緣閘門列，等角圖 px(948-1050,1910-1995)）"
    },
    {
      "id": "g-tc-tra-acc-e",
      "kind": "faregate",
      "system": "tra",
      "direction": "both",
      "accessible": true,
      "line": [
        [82, 16],
        [82, 22]
      ],
      "connects": [
        "a-tc-tra-paid",
        "a-tc-unpaid-e"
      ],
      "source": "tra-b1-map",
      "confidence": 2,
      "note": "東剪票口寬閘門（推定於群北端）"
    },
    {
      "id": "g-tc-tra-out-e",
      "kind": "faregate",
      "system": "tra",
      "direction": "out",
      "accessible": false,
      "line": [
        [82, -6],
        [82, 0]
      ],
      "connects": [
        "a-tc-tra-paid",
        "a-tc-unpaid-e"
      ],
      "source": "tra-b1-map",
      "confidence": 2,
      "note": "東剪票口出站閘門列（推定於進站列南側並設）"
    }
  ],
  "pois": [
    {
      "id": "p-tc-tvm-1",
      "kind": "tvm",
      "system": "tra",
      "position": [93.5, 10.5],
      "name": {
        "zh": "售票機"
      },
      "source": "tra-b1-map",
      "confidence": 2,
      "note": "示範集：東剪票口（n-tc-002）外側"
    },
    {
      "id": "p-tc-info-1",
      "kind": "info",
      "system": "tra",
      "position": [93.5, 15],
      "name": {
        "zh": "服務台"
      },
      "source": "tra-b1-map",
      "confidence": 2,
      "note": "示範集：東剪票口旁"
    },
    {
      "id": "p-tc-sign-1",
      "kind": "sign",
      "system": "tra",
      "position": [92, 22.5],
      "name": {
        "zh": "無障礙寬閘門指標"
      },
      "source": "tra-b1-map",
      "confidence": 2,
      "note": "示範集：錨定 n-tc-005 寬閘門外"
    },
    {
      "id": "p-tc-toilet-1",
      "kind": "toilet",
      "system": "tra",
      "position": [97, 32],
      "name": {
        "zh": "廁所"
      },
      "source": "tra-b1-map",
      "confidence": 1,
      "note": "公開資料推定：東側非付費區廁所（Phase 7 BUG-004，未經底圖描迹）"
    },
    {
      "id": "p-tc-exit-1",
      "kind": "exit",
      "system": "tra",
      "position": [130, 49],
      "name": {
        "zh": "出口"
      },
      "source": "tra-b1-map",
      "confidence": 1,
      "note": "公開資料推定：東翼通廊往中山地下街出入口方向（Phase 7 BUG-004）"
    }
  ],
  "nav": {
    "nodes": [
      {
        "id": "n-tc-001",
        "xy": [128, 30],
        "area": "a-tc-corridor"
      },
      {
        "id": "n-tc-002",
        "xy": [92, 12],
        "tier": 0,
        "area": "a-tc-unpaid-e",
        "name": {
          "zh": "B1 東剪票口外（非付費）"
        }
      },
      {
        "id": "n-tc-003",
        "xy": [70, 12],
        "tier": 0,
        "area": "a-tc-tra-paid",
        "name": {
          "zh": "B1 臺鐵東付費島"
        }
      },
      {
        "id": "n-tc-004",
        "xy": [120, 38],
        "area": "a-tc-corridor"
      },
      {
        "id": "n-tc-005",
        "xy": [92, 21],
        "tier": 2,
        "area": "a-tc-unpaid-e",
        "name": {
          "zh": "B1 東剪票口 寬閘門外"
        }
      },
      {
        "id": "n-tc-006",
        "xy": [70, 21],
        "area": "a-tc-tra-paid"
      },
      {
        "id": "n-tc-007",
        "xy": [76, 26],
        "tier": 2,
        "area": "a-tc-tra-paid",
        "name": {
          "zh": "B1 付費島 第4月台梯口"
        }
      },
      {
        "id": "n-tc-008",
        "xy": [76, 6],
        "tier": 2,
        "area": "a-tc-tra-paid",
        "name": {
          "zh": "B1 付費島 第3月台梯口"
        }
      },
      {
        "id": "n-tc-009",
        "xy": [97, 30],
        "area": "a-tc-unpaid-e",
        "name": {
          "zh": "B1 廁所（東側非付費區）"
        }
      },
      {
        "id": "n-tc-010",
        "xy": [130, 47],
        "area": "a-tc-corridor",
        "name": {
          "zh": "B1 出口（往中山地下街）"
        }
      },
      {
        "id": "n-tc-011",
        "xy": [92.9, -81.4],
        "tier": 2,
        "area": "a-tc-mrt-link"
      }
    ],
    "edges": [
      {
        "from": "n-tc-001",
        "to": "n-tc-002",
        "kind": "walk"
      },
      {
        "from": "n-tc-001",
        "to": "n-tc-004",
        "kind": "walk"
      },
      {
        "from": "n-tc-004",
        "to": "n-tc-005",
        "kind": "walk"
      },
      {
        "from": "n-tc-002",
        "to": "n-tc-005",
        "kind": "walk"
      },
      {
        "from": "n-tc-002",
        "to": "n-tc-003",
        "kind": "gate",
        "gate": "g-tc-tra-in-e",
        "bidir": false
      },
      {
        "from": "n-tc-005",
        "to": "n-tc-006",
        "kind": "gate",
        "gate": "g-tc-tra-acc-e",
        "bidir": true
      },
      {
        "from": "n-tc-006",
        "to": "n-tc-003",
        "kind": "walk"
      },
      {
        "from": "n-tc-003",
        "to": "n-tc-002",
        "kind": "gate",
        "gate": "g-tc-tra-out-e",
        "bidir": false
      },
      {
        "from": "n-tc-006",
        "to": "n-tc-007",
        "kind": "walk"
      },
      {
        "from": "n-tc-003",
        "to": "n-tc-008",
        "kind": "walk"
      },
      {
        "from": "n-tc-005",
        "to": "n-tc-009",
        "kind": "walk"
      },
      {
        "from": "n-tc-004",
        "to": "n-tc-010",
        "kind": "walk"
      },
      {
        "from": "n-tc-011",
        "to": "n-tc-002",
        "kind": "walk"
      }
    ]
  }
}
